id,type,type_name,type_desc,type_icon,is_open
int,int,string,string,string,int
1,1,102592,The Rank changes of members, appointment and dismissal of position holders are recorded here.,icon_AllianceRecord3,1
2,2,Alliance Droid,The progress of the Droid Donation, whether it is activated, and the status are recorded here.,icon_AllianceRecord1,1
3,3,102635,The research details and priorities of the Alliance Tech are recorded here.,icon_AllianceRecord4,1
4,4,Alliance Buildings,The progress and status of the Alliance Infrastructures are recorded here.,icon_AllianceRecord2,1