id,name,desc,label,labelDesc,hero_type,skillDesc,fragmentsNumber,quality,type,war,warAdd,def,defAdd,command,upStar1,upStar2,upStar3,upStar4,skill,source,hero_icon,icon_harmony,hero_tachie,black_hero_icon,black_hero_name,backGround,recommendedSkill,is_show,show_hero_id,exclude,plat,jp_des,get_show,time,endtime,timeType,skin,active_skill,skin_use,exclude_item,bg_img,is_link_hero,cn_idle_name,idle_name,skintime,skinendtime,skinitemid,idle_action_control,new_active_skill,hero_ui_effect,land_fight_scale,exclusive,upgrade,hero_cap_skill_group_id,hero_cap_skill_des,can_show,hero_cap_sp_type,hero_cap_sp_parma
117,Amalia,Amalia was born on an archeological site; her parents were well-known archaeologists. Just like her family; Amalia was also fascinated by Archaeology. In her world; the treasures and antiquities are fresh and alive; and she can hear the call of the treasure; so she can find all these relics and monuments; and strange secrets as well. Now she devotes herself to these strange secrets. She works for those who can invest in her research. She is willing to cooperate with the troops to obtain more information and returns.,Treasure Compass,,0,The hero will get a chest every time she defeats the Dark Legion; Warhammer; and Throb. The number of chests dropped each time is the Hero Star*1; and the daily limit is the Hero Star*4. The chest contains various items and Paint. (Paint can temporarily gain you buffs; which work like the base skin buffs. The effect is not stackable but effective time is stackable)\nFanatic Paint - increases the ATK of all units by 20%; lasts 30 minutes\nNatural Paint - increases the HP of Army by 20%; lasts 30 minutes\nTough Paint - DMG decrease (taken by your units) +10% for 30 minutes.    \n   \nHero at 1-3 star drops Ancient Silver Chest.\nOrange Universal Shard 2% \nPurple Universal Shard 9% \nFanatic Paint 10% \nNatural Paint 10%  \nSmall VIT Capsule 14%  \nTech Chest*100 35%  \nGeneral R&D Plan*100 15%    \nShining Gold Chest*5 5%  \n   \nHero at 4-5 star drops Ancient Gold Chest\nOrange Universal Shard 4% \nPurple Universal Shard 11% \nTough Paint 10% \nFanatic Paint 10% \nNatural Paint 10%  \nLarge VIT Capsule 5%  \nTech Chest*100 25%  \nGeneral R&D Plan*100 15%    \nShining Gold Chest*5 10%,10,5,1,420,88,180,31,400,352|124|0;352|124|0;352|124|0;352|124|0;1056|372|300,704|248|0;704|248|0;704|248|0;704|248|0;2112|744|400,1056|372|0;1056|372|0;1056|372|0;1056|372|0;3168|1116|400,1408|496|0;1408|496|0;1408|496|0;1408|496|0;4224|1488|500,10117,3,image/hero_icon/hero_icon117,,hero_tachie117,image/hero_icon/black_hero_icon117,No. 117,1,,1,117,1117,,jp_activityhero117,,,,2,2162,,1,2200056,,,,,,,,1|1;4|1,,,,,,117,The hero will get a chest every time she defeats the Dark Legion; Warhammer; and Throb. The number of chests dropped each time is the Hero Star*1; and the daily limit is the Hero Star*4. The chest contains various items and Paint. (Paint can temporarily gain you buffs; which work like the base skin buffs. The effect is not stackable but effective time is stackable)\nFanatic Paint - increases the ATK of all units by 20%; lasts 30 minutes\nNatural Paint - increases the HP of Army by 20%; lasts 30 minutes\nTough Paint - DMG decrease (taken by your units) +10% for 30 minutes.    \n   \nHero at 1-3 star drops Ancient Silver Chest.\nOrange Universal Shard 2% \nPurple Universal Shard 9% \nFanatic Paint 10% \nNatural Paint 10%  \nSmall VIT Capsule 14%  \nTech Chest*100 35%  \nGeneral R&D Plan*100 15%    \nShining Gold Chest*5 5%  \n   \nHero at 4-5 star drops Ancient Gold Chest\nOrange Universal Shard 4% \nPurple Universal Shard 11% \nTough Paint 10% \nFanatic Paint 10% \nNatural Paint 10%  \nLarge VIT Capsule 5%  \nTech Chest*100 25%  \nGeneral R&D Plan*100 15%    \nShining Gold Chest*5 10%,1,,
214,Violet,Violet loves competitions. She is a challenger that desires to compete with you in everything; she even chews her gum for longer durations than everyone else; I mean literally; she is holding the record for chewing gum the longest. She is very popular in the Freedom League as she always kill more enemies. With the help of Teresa; she developed a magnetic rubber bomb.,Bubble Killer,,1,Send this hero to battle to increase the ATK of naval units when attacking front row enemies.,10,5,1,407,90,193,30,400,256|224|0;256|224|0;256|224|0;256|224|0;768|672|300,512|448|0;512|448|0;512|448|0;512|448|0;1536|996|400,768|672|0;768|672|0;768|672|0;768|672|0;3072|1992|400,1024|896|0;1024|896|0;1024|896|0;1024|896|0;3072|2688|500,10214,1,image/hero_icon/hero_icon214,,hero_tachie214,image/hero_icon/black_hero_icon214,No. 214,2,,1,,,,,,,,2,2160,,1,,,,,,,,,,,,,,,214,Send this hero to battle to increase the ATK of naval units when attacking front row enemies.,1,,
1314,Pop4,Pop and Bob have known each other since they were children. They studyed mechanics from an expert; Vaillant. Vaillant's focus was on building more machines for the Dark Empire; rather than on new inventions. Soon after Bob learned that his studies and creations were being used as war machines by the Dark Empire; he left Vaillant's invention studio but Pop stayed. Years later despite the fact that the empire has fallen; Pop has advanced to the rank of master mechanic.4,The Mechanic4,守护圣女,2,You'll receive a Pop's Box every time she defeats the Dark Forces; Warhammer; and Throb. When this hero participates in battle; ATK of the first two rows will be increased and her skill gains you rage; which when activated attacks the row with the most number of units (Can't use universal shards to upgrade her; nor can she perform the Perk Exchange)4,10,5,1,452,85,158,35,400,352|124|0;352|124|0;352|124|0;352|124|0;1056|372|300,704|248|0;704|248|0;704|248|0;704|248|0;2112|744|400,1056|372|0;1056|372|0;1056|372|0;1056|372|0;3168|1116|400,1408|496|0;1408|496|0;1408|496|0;1408|496|0;4224|1488|500,11314,3,image/hero_icon/hero_icon1314,,hero_tachie1314_Kochikame,,,3,,1,314,314,g123,jp_activityhero1314,,2020-12-17-0-0-0,2020-12-24-0-0-0,1,2080|2081|2083|2084,,,2200061,Kochikame_hero_bg.jpg,1,,,,,,,,,,,,1314,You'll receive a Pop's Box every time she defeats the Dark Forces; Warhammer; and Throb. When this hero participates in battle; ATK of the first two rows will be increased and her skill gains you rage; which when activated attacks the row with the most number of units (Can't use universal shards to upgrade her; nor can she perform the Perk Exchange)4,1,,
314,Dante,Dante was a poet and a philosopher before joining the Air Force Special Operations Command. His mythological long poems were full of imagination. He even believed that this war was a continuation of his poetry. He was severely injured for resisting the invasion of the veteran; which forced him to join the Raven and perform operation "Bear Hunt". After completing the mission; he was transferred to the Allied Air Command as the Senior Military Officer.,Hawkeye,,2,Greatly increases the ATK and HP of your Air Force. When using this hero in your defense troop; Aerial Surveillance will provide intelligence that gains all units (including naval and army units) the same bonus.,10,5,1,452,85,158,35,400,352|124|0;352|124|0;352|124|0;352|124|0;1056|372|300,704|248|0;704|248|0;704|248|0;704|248|0;2112|744|400,1056|372|0;1056|372|0;1056|372|0;1056|372|0;3168|1116|400,1408|496|0;1408|496|0;1408|496|0;1408|496|0;4224|1488|500,10314,3,image/hero_icon/hero_icon314,,hero_tachie314,image/hero_icon/black_hero_icon314,No. 314,3,,1,,1314,,jp_activityhero314,,2020-12-10-0-0-0,2020-12-24-0-0-0,2,2179,,1,2200060,,,,,,,,1|1;4|1,,,,,,314,Greatly increases the ATK and HP of your Air Force. When using this hero in your defense troop; Aerial Surveillance will provide intelligence that gains all units (including naval and army units) the same bonus.,1,,
118,Ben,Ben was raised by his mother. He was born in the sinful neighborhood of the Fallen City. Street bullying and fighting... that's what it's all about. Ben has become a fighter; and a threat to the gangs even though mom cautioned him to stay away from the gangs. Ben had to go against his mother's advice when she was caught and held as leverage. He had to save his mother and was thus framed and jailed. Years of jail life made him even tougher and stronger; just waiting for an opportunity to get his revenge. Shortly after leaving jail he was recruited by the "Raven" squad and performed well in his first operation called "Bear Hunt". He led the team well and got promoted to captain of the squad. Now; he is retired; he is free; and he is a member of the Men of Freedom.,Big Ben,,0,Ben is taking the lead and keeps troops under his protection.,10,5,1,445,89,155,31,400,384|96|0;384|96|0;384|96|0;384|96|0;1152|288|300,768|192|0;768|192|0;768|192|0;768|192|0;2304|576|400,1152|288|0;1152|288|0;1152|288|0;1152|288|0;3456|864|400,1536|384|0;1536|384|0;1536|384|0;1536|384|0;4608|1152|500,10118,3,image/hero_icon/hero_icon118,,hero_tachie118,image/hero_icon/black_hero_icon118,No. 118,1,,1,,,,,,,,2,2090,,1,,,,,,,,,,,,,,,118,Ben is taking the lead and keeps troops under his protection.,1,,
119,Silence,Silence moves like a cat; she loves reading books on a peaceful afternoon; resting in her cozy living room; and she hates violence. She hates those hypocrites who advocate anti-war movements; while claiming that this is the war to end all wars. She believes that the man behind the organization should take responsibility for lives lost in the war. She received her first assassination mission from a little girl; who lost her mother during the conflict. Silence managed to sneak into the organization leader's office and ended his life. The Freedom League valued her assassination skill; and helped her escape from her pursuers. They sent a troop to escort her to the "SaND" for more missions and she has been working for "SaND" and eliminating her pursuers ever since.,The Silencer,,0,Silence throws out 2 Torrid Grenades with an explosion that would cause huge damage to the enemies. The shrapnel can also deal an extra burning damage.,10,5,1,470,92,130,28,400,380|100|0;380|100|0;380|100|0;380|100|0;1140|300|300,760|200|0;760|200|0;760|200|0;760|200|0;2280|600|400,1128|312|0;1128|312|0;1128|312|0;1128|312|0;3384|936|400,1520|400|0;1520|400|0;1520|400|0;1520|400|0;4560|1200|500,10119,3,image/hero_icon/hero_icon119,,hero_tachie119,image/hero_icon/black_hero_icon119,No. 119,1,,1,,,,,,2021-1-29-0-0-0,2029-12-24-0-0-0,1,,,1,,,,,,,,,1|1;4|1,,,,,,119,Silence throws out 2 Torrid Grenades with an explosion that would cause huge damage to the enemies. The shrapnel can also deal an extra burning damage.,1,,
215,914,Agent 914 is a spy working for the Faceless. The Faceless is excellent at disguising; so they also call them the agents with "Thousand Faces". It is said that their code name refers to the number of faces they have worn. Well; you may have run into one of those Faceless agents; if you are an important person. Like all the other Faceless agents; we barely know anything about this 914. Rumor has it that this organization is supported by the Freedom League; but somehow others are convinced that they work for the Dark Empire.,The Faceless,,1,914 intercepted the enemy's plan and strategy; giving us a great advantage.,10,5,2,190,34,410,86,400,140|340|0;140|340|0;140|340|0;140|340|0;420|1020|300,280|680|0;280|680|0;280|680|0;280|680|0;840|2040|400,420|1020|0;420|1020|0;420|1020|0;420|1020|0;1260|3060|400,560|1360|0;560|1360|0;560|1360|0;560|1360|0;1680|4080|500,10215,3,image/hero_icon/hero_icon215,,hero_tachie215,image/hero_icon/black_hero_icon215,black_914,2,,1,,,,,,2021-2-17-12-0-0,2029-1-21-0-0-0,1,2101|2172,,1,,,,,,2021-02-18-0-0-0,2021-02-25-0-0-0,14101206,1|1;4|1,,,,,,215,914 intercepted the enemy's plan and strategy; giving us a great advantage.,1,,
315,Villiers,Jane Villiers was born with a pair of heterochromatic eyes; so she was abandoned by her parents and everyone in her village treated her like a jinx. The poor little girl was adopted by the Duke of Buckingham; and the Duke treated her as his own family. With great efforts; she finally became a famous singer. During the war; the Duke of Buckingham participated in the Great Landing Campaign. Jane always visits her father to check up on him and all the soldiers love her encouraging song. "Her song sounds like a rainbow!!" a soldier said. And many soldiers even believe that anyone she kisses will be blessed with winning in the coming battles.,Heterochromia Celeb,,2,Set her in the formation to buff the ATK of all forces! Use her skill in Hero Panel to reduce damage taken.\nNOTE:\n1. The active skill is NOT effective for defense troops in the Warzone Exercise and Dimensional Mine.\n2. If you upgrade the hero/skill during the duration of this skill; you'll need to activate this skill again.,10,5,2,195,38,405,82,400,140|340|0;140|340|0;140|340|0;140|340|0;420|1020|300,280|680|0;280|680|0;280|680|0;280|680|0;840|2040|400,420|1020|0;420|1020|0;420|1020|0;420|1020|0;1260|3060|400,560|1360|0;560|1360|0;560|1360|0;560|1360|0;1680|4080|500,10315,3,image/hero_icon/hero_icon315,,hero_tachie315,image/hero_icon/black_hero_icon315,black_Villiers,3,,1,,,,,,2021-3-17-0-0-0,2029-1-21-0-0-0,1,2112|2113|2180,,1,,,,,,2021-03-11-0-0-0,2021-03-25-0-0-0,14101226,1|1;4|1,30315,,,,,315,Set her in the formation to buff the ATK of all forces! Use her skill in Hero Panel to reduce damage taken.\nNOTE:\n1. The active skill is NOT effective for defense troops in the Warzone Exercise and Dimensional Mine.\n2. If you upgrade the hero/skill during the duration of this skill; you'll need to activate this skill again.,1,,
120,Fahed,Fahed is a notable merchant who gained fame for being the "largest merchant" during the 90s. As an incredible salesman; he developed good persistence and outstanding people skills. He formed a group to take special missions; in which he could "give his merchandise a shot". The 90s has made him one of the richest merchant dealers; but he made a vow to himself; never trade with the ungrateful and disloyal Dark Empire. Keeping that in mind; he joined the Freedom League.,Panther Prince,,0,Provides HP Armor to protect all units and charges for a fatal attack!,10,5,1,479,95,121,25,400,352|124|0;352|124|0;352|124|0;352|124|0;1056|372|300,704|248|0;704|248|0;704|248|0;704|248|0;2112|744|400,1056|372|0;1056|372|0;1056|372|0;1056|372|0;3168|1116|400,1408|496|0;1408|496|0;1408|496|0;1408|496|0;4224|1488|500,10120,3,image/hero_icon/hero_icon120,,hero_tachie120,image/hero_icon/black_hero_icon120,black_Fahed,1,,1,,,,,,2021-4-13-0-0-0,2029-1-21-0-0-0,1,2121|2173,,1,,,,,,2021-4-15-0-0-0,2021-4-22-0-0-0,14101242,1|1;4|1,,,,,,120,Provides HP Armor to protect all units and charges for a fatal attack!,1,,
121,Delhuyar,Marie Delhuyar's father is a well-known mineralogist in the Freedom League. A dedicated scholar who has been working away from home for a long time. Marie grew up without love and attention and gave up her chance to go to college choosing to join the army instead. She wanted to find out why her father was so obsessed with those stones. The same year; Marie's father discovered the existence of Odinium. He was exposed to a lot of radiation; which caused him to get ARS. After realizing the importance of her father's finding; Marie continued her father's studies on Odinium.,The Prospector,德卢雅尔，采集英雄,0,Delhuyar is pretty good at gathering; especially for gathering the Odinium.,10,4,2,104,17,196,43,300,80|156|0;80|156|0;80|156|0;80|156|0;240|468|200,160|312|0;160|312|0;160|312|0;160|312|0;480|936|300,240|468|0;240|468|0;240|468|0;240|468|0;720|1404|300,320|624|0;320|624|0;320|624|0;320|624|0;960|1872|400,10121,11,image/hero_icon/hero_icon121,,hero_tachie121,image/hero_icon/black_hero_icon121,black_Delhuyar,1,,1,,,,,,,,2,,,1,,,,,,,,,,,,,,,121,Delhuyar is pretty good at gathering; especially for gathering the Odinium.,1,,
216,Akatora,Akatora was not the name his family gave him. He was born and brought up in a wealthy family; but he was not interested in inheriting the family business at all; so he left. One day he went to an Izakaya and met an old man. He had a pleasant chat with this old pal and he even paid off the old man's bill. In return; the old man gave him a sword study guide "Akazuna's Hidden Secret" and the Japanese sword "Tora (the Tiger)". It wasn't until then he realized that this old man in front of him was a Kendo master; who devoted his life to the art of the sword. He named himself after his master; and started to explore the secret of Kendo. Then the war came; Akatora resolutely joined the Freedom League. Although his sword skill is not as good as his master; Akatora's family has been secretly helping him; and made him a powerful armor - whenever the machine detects an extreme situation; a mysterious mech would show up...,Kendo Apprentice,,1,Akatora gets Rage at the beginning of the battle so that he can release his rage skill faster and destroy the enemies with anger.\nAkatora's Exclusive Skill gives extra attributes: \nLv. 3: When Akatora is in battle; increase ATK of all units by 20%.\nLv. 5: Damage taken by your units is reduced by 2% (not required to be in the battle).\nLv. 7: Rage skill launches 5~11 Missiles randomly. \nRage gained at the beginning of the battle ≤ slots with active units (if there are more than 9 slots with active units; there will be no limit on the initial Rage).\nIf the Rage is more than 7; the extra rage can be reserved for the next round.,10,5,2,195,32,405,88,400,140|340|0;140|340|0;140|340|0;140|340|0;420|1020|300,280|680|0;280|680|0;280|680|0;280|680|0;840|2040|400,420|1020|0;420|1020|0;420|1020|0;420|1020|0;1260|3060|400,560|1360|0;560|1360|0;560|1360|0;560|1360|0;1680|4080|500,10216,3,image/hero_icon/hero_icon216,,hero_tachie216,image/hero_icon/black_hero_icon215,black_Akatora,2,,1,,,,,,2021-05-14-20-0-0,2029-1-21-0-0-0,1,2131|2178,,1,,,,,,2021-5-15-0-0-0,2021-5-20-0-0-0,14101292,,,,,,,216,Akatora gets Rage at the beginning of the battle so that he can release his rage skill faster and destroy the enemies with anger.\nAkatora's Exclusive Skill gives extra attributes: \nLv. 3: When Akatora is in battle; increase ATK of all units by 20%.\nLv. 5: Damage taken by your units is reduced by 2% (not required to be in the battle).\nLv. 7: Rage skill launches 5~11 Missiles randomly. \nRage gained at the beginning of the battle ≤ slots with active units (if there are more than 9 slots with active units; there will be no limit on the initial Rage).\nIf the Rage is more than 7; the extra rage can be reserved for the next round.,1,,
122,Ishi Tarou,As a veteran in the Freedom League; Ishi Tarou has long been tired of the endless fighting. He set himself a slogan - you are right where you should be. Ishi Tarou; who has experienced many battles; is proud that he's never had an accident. When the Freedom League needed a mining expert; Ishi Tarou used his extensive knowledge of mining exploration; and volunteered to join the mining squad. Away from the frontline.,The Innovator,,0,Very good at fighting and gathering.,10,4,2,104,17,196,43,300,80|156|0;80|156|0;80|156|0;80|156|0;240|468|200,160|312|0;160|312|0;160|312|0;160|312|0;480|936|300,240|468|0;240|468|0;240|468|0;240|468|0;720|1404|300,320|624|0;320|624|0;320|624|0;320|624|0;960|1872|400,10122,3,image/hero_icon/hero_icon122,,hero_tachie122,image/hero_icon/black_hero_icon122,black_Ishi Tarou,1,,1,,,,,,2021-05-14-20-0-0,2029-1-21-0-0-0,1,,,1,,,,,,,,,,,,,,,122,Delhuyar is pretty good at gathering; especially for gathering the Odinium.,1,,
123,Scaramanga,Scaramanga is a military engineer; and was assigned to the Super Weapon Center. Tin Woodsman - as called by his fellow colleagues. His facial nerves were damaged in an accident and he suffered from heliophobia. He couldn't smile; blink; or make any expressions. This made no difference his already quiet and serious demeanor. After Dr. Gero gave him an Odinium prosthetic arm; he devoted himself to repairing Valhalla units.,Tin Woodman,,0,Very helpful when training and repairing Valhalla Units!,10,5,2,445,96,155,24,400,384|96|0;384|96|0;384|96|0;384|96|0;1152|288|300,768|192|0;768|192|0;768|192|0;768|192|0;2304|576|400,1152|288|0;1152|288|0;1152|288|0;1152|288|0;3456|864|400,1536|384|0;1536|384|0;1536|384|0;1536|384|0;4608|1152|500,10123,3,image/hero_icon/hero_icon123,,hero_tachie123,image/hero_icon/black_hero_icon215,black_Scaramanga,1,,1,,,,,,2021-02-02-0-0-0,2029-1-21-0-0-0,1,,,1,,,,,,,,,1|1;4|1,,,,,,123,Very helpful when training and repairing Valhalla Units!,1,,
316,Aya,Aya is the daughter of the great chief of an ancient tribe. To fight the Dark Empire; the Freedom League destroyed and invaded Aya's homeland. "The Freedom League is no better than the Dark Empire!". She will never forgive the League that destroyed her home; and the Empire that stole the Sacred Item. So fearlessly; she started her own journey of revenge to fight back.,The Chosen One,,2,Aya's Power of Nature will greatly improve the DEF of the front row! When your mid or back row unit attacks; there is a chance to summon a Thunder Blast that attacks the enemy units randomly!,10,5,2,195,39,405,81,400,140|340|0;140|340|0;140|340|0;140|340|0;420|1020|300,280|680|0;280|680|0;280|680|0;280|680|0;840|2040|400,420|1020|0;420|1020|0;420|1020|0;420|1020|0;1260|3060|400,560|1360|0;560|1360|0;560|1360|0;560|1360|0;1680|4080|500,10316,3,image/hero_icon/hero_icon316,,hero_tachie316,image/hero_icon/black_hero_icon215,black_hero_name616,3,,1,,,,,,2021-06-17-00-0-0,2029-1-21-0-0-0,1,,,1,,,,,,,,,1|1;4|1,,,,,,316,Aya's Power of Nature will greatly improve the DEF of the front row! When your mid or back row unit attacks; there is a chance to summon a Thunder Blast that attacks the enemy units randomly!,1,,
217,Bailos,Ahenarbe is an organization empowered and entrusted by the Dark Legion with the task of investigating anomalous objects; entities; and phenomena. In the past Astrology received widespread public interest and was not fully understood. The Ahenarbe were instructed to abduct and detain a number of astrologers and soothsayers with the intention of performing numerous experiments on them. Bailos' parents and little brother were among these captured astrologers. Bailos joined the Freedom league to find her family and bring an end to Ahenarbe.,Trail of the Star,,1,When this hero participates in battle; the attack performance of your Naval units will be greatly improved.\nHeroes that can decrease opponent's ATK: Rockfield; Teresa; Bell; Akatora; Yuu,10,5,1,430,78,170,42,400,352|124|0;352|124|0;352|124|0;352|124|0;1056|372|300,704|248|0;704|248|0;704|248|0;704|248|0;2112|744|400,1056|372|0;1056|372|0;1056|372|0;1056|372|0;3168|1116|400,1408|496|0;1408|496|0;1408|496|0;1408|496|0;4224|1488|500,10217,3,image/hero_icon/hero_icon217,,hero_tachie217,image/hero_icon/black_hero_icon215,black_Bailos,2,,1,,,,,,2021-07-14-0-0-0,2029-1-21-0-0-0,1,2143,,1,,,,,,2021-7-15-0-0-0,2021-7-22-0-0-0,14101323,1|1;4|1,,,,,,217,When this hero participates in battle; the attack performance of your Naval units will be greatly improved.\nHeroes that can decrease opponent's ATK: Rockfield; Teresa; Bell; Akatora; Yuu,1,,
124,Optimus Prime,Optimus Prime is the leader of the Autobots. He is smart; spirited; courageous and a tireless defender of the weak. Born of humble beginnings; he became a hero by raising his voice in support of freedom. He became a legend by picking up a sword and putting his spark on the line to fight for it. He converts into a powerful truck for vehicle mode combat!,Leader of the Autobots,,0,Til' All Are One! Optimus Prime's skill improves DEF of all units for the first round (1 round only) the skill is released; and the next round improves ATK of all units till the battle ends.,10,5,2,185,35,425,85,400,140|340|0;140|340|0;140|340|0;140|340|0;420|1020|300,280|680|0;280|680|0;280|680|0;280|680|0;840|2040|400,420|1020|0;420|1020|0;420|1020|0;420|1020|0;1260|3060|400,560|1360|0;560|1360|0;560|1360|0;560|1360|0;1680|4080|500,10124,3,image/hero_icon/hero_icon124,,hero_tachie124,image/hero_icon/black_hero_icon215,black_Optimus Prime,1,,1,,,,,,2021-08-06-0-0-0,2029-1-21-0-0-0,1,,,1,,,,,,,,,1|1;4|1,,,,,,124,Til' All Are One! Optimus Prime's skill improves DEF of all units for the first round (1 round only) the skill is released; and the next round improves ATK of all units till the battle ends.,1,,
125,Bumblebee,Bumblebee is the youngest member and one of the last recruits to the Autobots team. An exuberant and energetic adventurer; his delightful charm and optimism welcomes everyone he meets. He looks up to Optimus Prime as a father figure and is wholeheartedly devoted to his leader’s mission to secure freedom for all sentient beings. In Top War; Bumblebee converts into a small car; capable of great speed and endurance during vehicle combat!,Autobots Scout,,0,The rare Bumblebee is very brave with 100% critical hit super missile! (Only effective against Dark Forces),10,4,1,218,40,82,19,300,172|64|0;172|64|0;172|64|0;172|64|0;516|192|200,344|128|0;344|128|0;344|128|0;344|128|0;1032|384|300,516|192|0;516|192|0;516|192|0;516|192|0;1548|576|300,688|256|0;688|256|0;688|256|0;688|256|0;2064|768|400,10125,12|5622|747,image/hero_icon/hero_icon125,,hero_tachie125,image/hero_icon/black_hero_icon215,black_Bumblebee,1,,1,,,,,,2021-08-10-0-0-0,2029-1-21-0-0-0,1,,,1,,,,,,,,,1|1;4|1,,,,1,2010099;1;128;5,125,The rare Bumblebee is very brave with 100% critical hit super missile! (Only effective against Dark Forces),1,,
